rank,index,score,TRACK_ID,caption,PATH
1,5651,0.13148418068885803,track_0995792,"A haunting melody played on a saxophone over a slow, ambient electronic piece with drums and synthesizers. Keywords: haunting, melody, saxophone, ambient.",92/995792.mp3
2,16900,0.09918635338544846,track_1383742,"A soothing, ambient instrumental piece with a gentle piano melody and sustained synth string sound. Keywords: relaxing, calming, soft, mellow.",42/1383742.mp3
3,2808,0.09070681780576706,track_0523752,"A soothing instrumental with gentle waves and soft piano arpeggios that create a calming, relaxing soundscape perfect for meditation or yoga. Keywords: calming, relaxing, meditation, yoga.",52/523752.mp3
4,1493,0.08883810043334961,track_0189568,"A soothing instrumental piece with a slow tempo featuring a saxophone solo over a mellow synth pad and soft drums. Keywords: relaxing, calming, soft, mellow.",68/189568.mp3
5,1407,0.08757181465625763,track_0169262,"A gentle melody played on a clarinet. Keywords: soft, melodic, calming, serene.",62/169262.mp3
